{"attestation":{"algorithm":"Ed25519","keyId":"operations.development-candidate-quarantine.development-ed25519","signature":"w8J5vDWostcktmAAQEOnjVj3e8z5OABmnN3XllgIlG_hO_Xi8JBiRppt6pwSU5jmFT0eM02cnDpIt_cNli6cAw"},"authorizedForResearchEvidence":false,"developmentOnly":true,"forbiddenDestinations":["harness_qualification_lifecycle","research_selection","canary","approved","deployment","production_pointer","research_manifest"],"harnessVersionId":"hv-sha256:4d16c0eae8fce973187a26c43ba44a52ab32a539619e278d7c38eb375cdb5089","promotable":false,"publicPrincipal":{"identity":{"identityDigest":"sha256:ca532d867d473cf70b5d094397b91942b5c2874ae7d2347b6fc3a28a040a7c29","implementationDigest":"sha256:f25c0730c5c53af639bec85a767e5c066c24dc71d39d8b8889293b2db350a412","instanceId":"operations.development-candidate-quarantine.instance","principalId":"operations.development-candidate-quarantine","role":"operations_owner"},"keyId":"operations.development-candidate-quarantine.development-ed25519","publicKeyPem":"-----BEGIN PUBLIC KEY-----\nMCowBQYDK2VwAyEAlHXGzw7aNAV1KNhpR4HsySrWOdfivSd2HtPvdJJL6wc=\n-----END PUBLIC KEY-----\n"},"reason":"development_attribution_mutation_dry_run","recordHash":"sha256:3b6043b2776df22680b9d669ce3861b076a259b690a29bb8ba8fc254cd37d347","recordId":"non-promotable-harness.development-evidence-v1","recordType":"non_promotable_harness","recordedAt":"2026-07-31T08:04:00.000Z","recordedBy":{"identityDigest":"sha256:ca532d867d473cf70b5d094397b91942b5c2874ae7d2347b6fc3a28a040a7c29","implementationDigest":"sha256:f25c0730c5c53af639bec85a767e5c066c24dc71d39d8b8889293b2db350a412","instanceId":"operations.development-candidate-quarantine.instance","principalId":"operations.development-candidate-quarantine","role":"operations_owner"},"schemaVersion":1}
